{
  "schema_version": "iam.identity.v1",
  "active": true,
  "issuer": "air-agent-iam",
  "audience": "iam-admin",
  "principal": {"type": "human", "id": "11111111-1111-4111-8111-111111111112", "realm": "workforce"},
  "user": {"id": "11111111-1111-4111-8111-111111111112", "account": "new_member", "display_name": "未选企业成员", "status": "active"},
  "session": {
    "id": "22222222-2222-4222-8222-222222222223",
    "ctx_version": 1,
    "created_at": "2026-10-14T00:00:00Z",
    "expires_at": "2026-10-21T01:00:00Z",
    "absolute_expires_at": "2026-11-13T00:00:00Z",
    "idle_expires_at": "2026-10-21T01:00:00Z"
  },
  "current_tenant": null,
  "membership": null,
  "platform_roles": [],
  "tenant_roles": [],
  "permissions": [],
  "revisions": {"user_auth_revision": 0, "tenant_auth_revision": 0, "membership_revision": 0, "session_ctx_version": 1},
  "context_version": 1,
  "platform_admin": false,
  "context_usable": false,
  "needs_tenant_selection": true,
  "evaluated_at": "2026-10-14T01:00:00Z"
}
